{
  "schema_version": "dashboard_snapshot_v1",
  "generated_at": "2026-05-03T16:06:03Z",
  "metadata": {
    "region": "gb",
    "latest_date": "2026-03-23",
    "data_freshness": "Local demo evidence snapshot; not live market freshness",
    "status": "watch"
  },
  "summary_cards": [
    {
      "label": "Market Price",
      "value": "127.05 GBP/MWh",
      "trend": "From validated energy_input_v1 evidence",
      "status": "watch"
    },
    {
      "label": "Demand",
      "value": "43,492.00 MW",
      "trend": "From validated energy_input_v1 evidence",
      "status": "ok"
    },
    {
      "label": "News Articles",
      "value": "3",
      "trend": "Curated RSS summaries available",
      "status": "ok"
    }
  ],
  "insights": [
    {
      "id": "insight-2026-03-23-gb-001",
      "title": "GB energy context linked to: BP mulls North Sea sale",
      "summary": "Validated energy evidence shows demand at 43,492 MW and market price at 127.05 GBP/MWh. Relevant curated news: One of the last remaining super major operators in the UK continental shelf is considering options after UK energy minster Ed Miliband steps back from accusations BP is 'morally wrong'.",
      "risk_level": "watch",
      "confidence": 0.85,
      "sources": [
        {
          "label": "elexon - system_buy_price_gbp_mwh",
          "url": "s3://energy-market-lake-portfolio-sandbox-20260321/curated/curated_dataset_electricity_3d55606ee40ee8a52f504210ea44aa85/date=2026-03-23/"
        },
        {
          "label": "Energy Voice",
          "url": "https://www.energyvoice.com/oilandgas/north-sea/596906/bp-mulls-north-sea-sale/"
        }
      ]
    }
  ],
  "data_quality": {
    "status": "ok",
    "checks": [
      {
        "label": "Energy contract",
        "status": "ok",
        "detail": "Publisher input came from local demo energy_input_v1 evidence."
      },
      {
        "label": "News contract",
        "status": "ok",
        "detail": "Publisher input came from local demo curated news_summary_v1 evidence."
      },
      {
        "label": "AI insight contract",
        "status": "ok",
        "detail": "Publisher insight came from local demo validated ai_insight_v1 evidence."
      },
      {
        "label": "Public fields",
        "status": "ok",
        "detail": "Local demo snapshot includes only dashboard-safe fields."
      }
    ]
  }
}
